,translated_answer,translated_question,question,answer,qa_pair_score,most_relevant_contexts,context_scores,true_answer,true_context,true_answer_similarity_score,true_context_similarity_score,true_answer_ROUGE_L
17,by shaven off a bit of probability mass and discounting them to events we,How can language models be prevented from assigning zero probability to unknown words?,How can language models be prevented from assigning zero probability to unknown words?,by shaven off a bit of probability mass and discounting them to events we,"[{'label': 'LABEL_0', 'score': 0.9454239010810852}]","['There are two common ways to train the probabilities of the unknown word model <UNK>. The first one is to turn the problem back into a closed vocabulary one by choosing a fixed vocabulary in advance:', 'Matching genres and dialects is still not sufficient. Our models may still be subject to the problem of sparsity. For any n-gram that occurred a sufficient number of times, we might have a good estimate of its probability. But because any corpus is limited, some perfectly acceptable English word sequences are bound to be missing from it. That is, we\'ll have many cases of putative ""zero probability n-grams"" that should really have some non-zero probability. Consider the words that follow the bigram denied the in the WSJ Treebank3 corpus, together with their counts: denied the allegations: 5 denied the speculation: 2 denied the rumors: 1 denied the report: 1', ""But suppose our test set has phrases like: denied the offer denied the loan Our model will incorrectly estimate that the P(offer|denied the) is 0! These zerosthings that don't ever occur in the training set but do occur in zeros the test set-are a problem for two reasons. First, their presence means we are underestimating the probability of all sorts of words that might occur, which will hurt the performance of any application we want to run on this data. Second, if the probability of any word in the test set is 0, the entire probability of the test set is 0. By definition, perplexity is based on the inverse probability of the test set. Thus if some words have zero probability, we can't compute perplexity at all, since we can't divide by 0!"", '• Language models offer a way to assign a probability to a sentence or other sequence of words, and to predict a word from preceding words. • n-grams are Markov models that estimate words from a fixed window of previous words. n-gram probabilities can be estimated by counting in a corpus and normalizing (the maximum likelihood estimate). • n-gram language models are evaluated extrinsically in some task, or intrinsically using perplexity. • The perplexity of a test set according to a language model is the geometric mean of the inverse test set probability computed by the model. • Smoothing algorithms provide a more sophisticated way to estimate the probability of n-grams. Commonly used smoothing algorithms for n-grams rely on lower-order n-gram counts through backoff or interpolation.', ""What do we do with words that are in our vocabulary (they are not unknown words) but appear in a test set in an unseen context (for example they appear after a word they never appeared after in training)? To keep a language model from assigning zero probability to these unseen events, we'll have to shave off a bit of probability mass from some more frequent events and give it to the events we've never seen. This modification is called smoothing or discounting. In this section and the folsmoothing discounting lowing ones we'll introduce a variety of ways to do smoothing: Laplace (add-one) smoothing, add-k smoothing, stupid backoff, and Kneser-Ney smoothing.""]","[0.7552979588508606, 0.7754663825035095, 0.7929489016532898, 0.8039191961288452, 0.8050786852836609]",smoothing or discounting,"What do we do with words that are in our vocabulary (they are not unknown words) but appear in a test set in an unseen context (for example they appear after a word they never appeared after in training)? To keep a language model from assigning zero probability to these unseen events, we'll have to shave off a bit of probability mass from some more frequent events and give it to the events we've never seen. This modification is called smoothing or discounting. In this section and the folsmoothing discounting lowing ones we'll introduce a variety of ways to do smoothing: Laplace (add-one) smoothing, add-k smoothing, stupid backoff, and Kneser-Ney smoothing.",tensor([[0.3608]]),tensor([[0.5020]]),0.11764705591695508
18,pruning,What technique can be used to shrink an n-gram language model?,What technique can be used to shrink an n-gram language model?,pruning,"[{'label': 'LABEL_1', 'score': 0.9335383176803589}]","['An n-gram language model can also be shrunk by pruning, for example only storing n-grams with counts greater than some threshold (such as the count threshold of 40 used for the Google n-gram release) or using entropy to prune less-important n-grams (Stolcke, 1998) . Another option is to build approximate language models using techniques like Bloom filters (Talbot and Osborne 2007, Church et al. 2007) .', ""Modern language modeling is more commonly done with neural network language models, which solve the major problems with n-grams: the number of parameters increases exponentially as the n-gram order increases, and n-grams have no way to generalize from training to test set. Neural language models instead project words into a continuous space in which words with similar contexts have similar representations. We'll introduce both feedforward language models (Bengio et al. 2006 , Schwenk 2007 in Chapter 7, and recurrent language models (Mikolov, 2012) in Chapter 9."", ""Although with these toolkits it is possible to build web-scale language models using full Kneser-Ney smoothing, Brants et al. (2007) show that with very large language models a much simpler algorithm may be sufficient. The algorithm is called stupid backoff. Stupid backoff gives up the idea of trying to make the language stupid backoff model a true probability distribution. There is no discounting of the higher-order probabilities. If a higher-order n-gram has a zero count, we simply backoff to a lower order n-gram, weighed by a fixed (context-independent) weight. This algorithm does not produce a probability distribution, so we'll follow Brants et al. (2007) in referring to it as S:"", 'This chapter introduced language modeling and the n-gram, one of the most widely used tools in language processing.', '• Language models offer a way to assign a probability to a sentence or other sequence of words, and to predict a word from preceding words. • n-grams are Markov models that estimate words from a fixed window of previous words. n-gram probabilities can be estimated by counting in a corpus and normalizing (the maximum likelihood estimate). • n-gram language models are evaluated extrinsically in some task, or intrinsically using perplexity. • The perplexity of a test set according to a language model is the geometric mean of the inverse test set probability computed by the model. • Smoothing algorithms provide a more sophisticated way to estimate the probability of n-grams. Commonly used smoothing algorithms for n-grams rely on lower-order n-gram counts through backoff or interpolation.']","[0.5955697894096375, 0.8389870524406433, 0.8651378154754639, 0.8655325174331665, 0.8729860186576843]",pruning,"An n-gram language model can also be shrunk by pruning, for example only storing n-grams with counts greater than some threshold (such as the count threshold of 40 used for the Google n-gram release) or using entropy to prune less-important n-grams (Stolcke, 1998) . Another option is to build approximate language models using techniques like Bloom filters (Talbot and Osborne 2007, Church et al. 2007) .",tensor([[1.]]),tensor([[1.]]),0.999999995
19,.,When is a stochastic process said to be stationary?,When is a stochastic process said to be stationary?,.,"[{'label': 'LABEL_0', 'score': 0.9707133769989014}]","[""A stochastic process is said to be stationary if the probabilities it assigns to a Stationary sequence are invariant with respect to shifts in the time index. In other words, the probability distribution for words at time t is the same as the probability distribution at time t + 1. Markov models, and hence n-grams, are stationary. For example, in a bigram, P i is dependent only on P i−1 . So if we shift our time index by x, P i+x is still dependent on P i+x−1 . But natural language is not stationary, since as we show in Chapter 12, the probability of upcoming words can be dependent on events that were arbitrarily distant and time dependent. Thus, our statistical models only give an approximation to the correct distributions and entropies of natural language. To summarize, by making some incorrect but convenient simplifying assumptions, we can compute the entropy of some stochastic process by taking a very long sample of the output and computing its average log probability. Now we are ready to introduce cross-entropy. The cross-entropy is useful when cross-entropy we don't know the actual probability distribution p that generated some data. It allows us to use some m, which is a model of p (i.e., an approximation to p). The cross-entropy of m on p is defined by"", 'Again, following the Shannon-McMillan-Breiman theorem, for a stationary ergodic process:', 'Stochastic gradient descent is an online algorithm that minimizes the loss function by computing its gradient after each training example, and nudging θ in the right direction (the opposite direction of the gradient). (an ""online algorithm"" is one that processes its input example by example, rather than waiting until it sees the entire input). x is the set of training inputs', ""Stochastic gradient descent is called stochastic because it chooses a single random example at a time, moving the weights so as to improve performance on that single example. That can result in very choppy movements, so it's common to compute the gradient over batches of training instances rather than a single instance."", 'The fact that the computation at time t requires the value of the hidden layer from time t − 1 mandates an incremental inference algorithm that proceeds from the start of the sequence to the end as illustrated in Fig. 9 .4. The sequential nature of simple recurrent networks can also be seen by unrolling the network in time as is shown in Fig. 9 .5. In this figure, the various layers of units are copied for each time step to illustrate that they will have differing values over time. However, the various weight matrices are shared across time.']","[0.8940915465354919, 0.9811690449714661, 1.0732767581939697, 1.083152413368225, 1.1163939237594604]",A stochastic process is said to be stationary if the probabilities it assigns to a Stationary sequence are invariant with respect to shifts in the time index.,"A stochastic process is said to be stationary if the probabilities it assigns to a Stationary sequence are invariant with respect to shifts in the time index. In other words, the probability distribution for words at time t is the same as the probability distribution at time t + 1. Markov models, and hence n-grams, are stationary. For example, in a bigram, P i is dependent only on P i−1 . So if we shift our time index by x, P i+x is still dependent on P i+x−1 . But natural language is not stationary, since as we show in Chapter 12, the probability of upcoming words can be dependent on events that were arbitrarily distant and time dependent. Thus, our statistical models only give an approximation to the correct distributions and entropies of natural language. To summarize, by making some incorrect but convenient simplifying assumptions, we can compute the entropy of some stochastic process by taking a very long sample of the output and computing its average log probability. Now we are ready to introduce cross-entropy. The cross-entropy is useful when cross-entropy we don't know the actual probability distribution p that generated some data. It allows us to use some m, which is a model of p (i.e., an approximation to p). The cross-entropy of m on p is defined by",tensor([[-0.0422]]),tensor([[1.0000]]),0.0
20,because it would take a lot of time and money to compute.,Why are simplifying assumptions needed when using a Naive Bayes Classifier?,Why are simplifying assumptions needed when using a Naive Bayes Classifier?,because it would take a lot of time and money to compute.,"[{'label': 'LABEL_0', 'score': 0.9764050245285034}]","['Unfortunately, Eq. 4.6 is still too hard to compute directly: without some simplifying assumptions, estimating the probability of every possible combination of features (for example, every possible set of words and positions) would require huge numbers of parameters and impossibly large training sets. Naive Bayes classifiers therefore make two simplifying assumptions.', ""The second is commonly called the naive Bayes assumption: this is the condi-naive Bayes assumption tional independence assumption that the probabilities P( f i |c) are independent given the class c and hence can be 'naively' multiplied as follows:"", ""Despite the less accurate probabilities, naive Bayes still often makes the correct classification decision. Furthermore, naive Bayes can work extremely well (sometimes even better than logistic regression) on very small datasets (Ng and Jordan, 2002) or short documents (Wang and Manning, 2012). Furthermore, naive Bayes is easy to implement and very fast to train (there's no optimization step). So it's still a reasonable approach to use in some situations."", 'As we saw in the previous section, naive Bayes classifiers can use any sort of feature: dictionaries, URLs, email addresses, network features, phrases, and so on. But if, as in the previous section, we use only individual word features, and we use all of the words in the text (not a subset), then naive Bayes has an important similarity to language modeling. Specifically, a naive Bayes model can be viewed as a set of class-specific unigram language models, in which the model for each class instantiates a unigram language model.', 'Let\'s walk through an example of training and testing naive Bayes with add-one smoothing. We\'ll use a sentiment analysis domain with the two classes positive (+) and negative (-), and take the following miniature training and test documents simplified from actual movie reviews. : P(−) = 3 5 P(+) = 2 5 The word with doesn\'t occur in the training set, so we drop it completely (as mentioned above, we don\'t use unknown word models for naive Bayes). The likelihoods from the training set for the remaining three words ""predictable"", ""no"", and ""fun"", are as follows, from Eq. 4.14 (computing the probabilities for the remainder of the words in the training set is left as an exercise for the reader): P(""predictable""|−) = 1 + 1 14 + 20 P(""predictable""|+) = 0 + 1 9 + 20 P(""no""|−) = 1 + 1 14 + 20 P(""no""|+) = 0 + 1 9 + 20 P(""fun""|−) = 0 + 1 14 + 20 P(""fun""']","[0.8405870199203491, 0.8806278705596924, 0.935146152973175, 0.942367672920227, 0.9441882967948914]","without some simplifying assumptions, estimating the probability of every possible combination of features (for example, every possible set of words and positions) would require huge numbers of parameters and impossibly large training sets.","Unfortunately, Eq. 4.6 is still too hard to compute directly: without some simplifying assumptions, estimating the probability of every possible combination of features (for example, every possible set of words and positions) would require huge numbers of parameters and impossibly large training sets. Naive Bayes classifiers therefore make two simplifying assumptions.",tensor([[0.1166]]),tensor([[1.0000]]),0.15384614958579892
21,add-one smoothing,What can be done to optimize Naive Bayes when an insufficient amount of labeled data is present?,What can be done to optimize Naive Bayes when an insufficient amount of labeled data is present?,add-one smoothing,"[{'label': 'LABEL_0', 'score': 0.9508930444717407}]","['But since naive Bayes naively multiplies all the feature likelihoods together, zero probabilities in the likelihood term for any class will cause the probability of the class to be zero, no matter the other evidence! The simplest solution is the add-one (Laplace) smoothing introduced in Chapter 3. While Laplace smoothing is usually replaced by more sophisticated smoothing algorithms in language modeling, it is commonly used in naive Bayes text categorization:P', 'Let\'s walk through an example of training and testing naive Bayes with add-one smoothing. We\'ll use a sentiment analysis domain with the two classes positive (+) and negative (-), and take the following miniature training and test documents simplified from actual movie reviews. : P(−) = 3 5 P(+) = 2 5 The word with doesn\'t occur in the training set, so we drop it completely (as mentioned above, we don\'t use unknown word models for naive Bayes). The likelihoods from the training set for the remaining three words ""predictable"", ""no"", and ""fun"", are as follows, from Eq. 4.14 (computing the probabilities for the remainder of the words in the training set is left as an exercise for the reader): P(""predictable""|−) = 1 + 1 14 + 20 P(""predictable""|+) = 0 + 1 9 + 20 P(""no""|−) = 1 + 1 14 + 20 P(""no""|+) = 0 + 1 9 + 20 P(""fun""|−) = 0 + 1 14 + 20 P(""fun""', 'While standard naive Bayes text classification can work well for sentiment analysis, some small changes are generally employed that improve performance. First, for sentiment classification and a number of other text classification tasks, whether a word occurs or not seems to matter more than its frequency. Thus it often improves performance to clip the word counts in each document at 1 (see the end of the chapter for pointers to these results). This variant is called binary multinomial naive Bayes or binary NB. The variant uses the same Eq. 4.10 except binary NB that for each document we remove all duplicate words before concatenating them into the single big document. Fig. 4 .3 shows an example in which a set of four documents (shortened and text-normalized for this example) are remapped to binary, with the modified counts shown in the table on the right. The example is worked without add-1 smoothing to make the differences clearer. Note that the results counts need not be 1; the word great has a count of 2 even for Binary NB, because it appears in multiple documents.', 'Many language processing tasks involve classification, although luckily our classes are much easier to define than those of Borges. In this chapter we introduce the naive Bayes algorithm and apply it to text categorization, the task of assigning a label or text categorization category to an entire text or document.', ""Up to now we have been describing text classification tasks with only two classes. But lots of classification tasks in language processing have more than two classes. For sentiment analysis we generally have 3 classes (positive, negative, neutral) and even more classes are common for tasks like part-of-speech tagging, word sense disambiguation, semantic role labeling, emotion detection, and so on. Luckily the naive Bayes algorithm is already a multi-class classification algorithm. But we'll need to slightly modify our definitions of precision and recall. Consider the sample confusion matrix for a hypothetical 3-way one-of email categorization decision (urgent, normal, spam) shown in Fig. 4 .5. The matrix shows, for example, that the system mistakenly labeled one spam document as urgent, and we have shown how to compute a distinct precision and recall value for each class. In order to derive a single metric that tells us how well the system is doing, we can combine these values in two ways. In macroaveraging, we compute the performance macroaveraging for each class, and then average over classes. In microaveraging, we collect the demicroaveraging cisions for all classes into a single confusion matrix, and then compute precision and recall from that table. Fig. 4 .6 shows the confusion matrix for each class separately, and shows the computation of microaveraged and macroaveraged precision.""]","[0.9347869753837585, 0.93932044506073, 0.9470751881599426, 0.9778698682785034, 0.9849942326545715]","derive the positive and negative word features from sentiment lexicons, lists of words that are pre-sentiment lexicons annotated with positive or negative sentiment.","Finally, in some situations we might have insufficient labeled training data to train accurate naive Bayes classifiers using all words in the training set to estimate positive and negative sentiment. In such cases we can instead derive the positive and negative word features from sentiment lexicons, lists of words that are pre-sentiment lexicons annotated with positive or negative sentiment. Four popular lexicons are the General Inquirer (Stone et al., 1966) , LIWC (Pennebaker et al., 2007) , the opinion lexicon",tensor([[-0.0293]]),tensor([[0.3192]]),0.0
22,"dictionaries, URLs, email addresses, network features, phrases",What type of features can be used to train a Naive Bayes classifier?,What type of features can be used to train a Naive Bayes classifier?,"dictionaries, URLs, email addresses, network features, phrases","[{'label': 'LABEL_1', 'score': 0.748999297618866}]","['As we saw in the previous section, naive Bayes classifiers can use any sort of feature: dictionaries, URLs, email addresses, network features, phrases, and so on. But if, as in the previous section, we use only individual word features, and we use all of the words in the text (not a subset), then naive Bayes has an important similarity to language modeling. Specifically, a naive Bayes model can be viewed as a set of class-specific unigram language models, in which the model for each class instantiates a unigram language model.', 'to make a classification decision —like naive Bayes and also logistic regression—', ""In the previous section we pointed out that naive Bayes doesn't require that our classifier use all the words in the training data as features. In fact features in naive Bayes can express any property of the input text we want."", 'Many kinds of machine learning algorithms are used to build classifiers. This chapter introduces naive Bayes; the following one introduces logistic regression. These exemplify two ways of doing classification. Generative classifiers like naive Bayes build a model of how a class could generate some input data. Given an observation, they return the class most likely to have generated the observation. Discriminative classifiers like logistic regression instead learn what features from the input are most useful to discriminate between the different possible classes. While discriminative systems are often more accurate and hence more commonly used, generative classifiers still have a role.', 'Unfortunately, Eq. 4.6 is still too hard to compute directly: without some simplifying assumptions, estimating the probability of every possible combination of features (for example, every possible set of words and positions) would require huge numbers of parameters and impossibly large training sets. Naive Bayes classifiers therefore make two simplifying assumptions.']","[0.6771665811538696, 0.8023751378059387, 0.8044253587722778, 0.8286704421043396, 0.8463932871818542]","dictionaries, URLs, email addresses, network features, phrases","As we saw in the previous section, naive Bayes classifiers can use any sort of feature: dictionaries, URLs, email addresses, network features, phrases, and so on. But if, as in the previous section, we use only individual word features, and we use all of the words in the text (not a subset), then naive Bayes has an important similarity to language modeling. Specifically, a naive Bayes model can be viewed as a set of class-specific unigram language models, in which the model for each class instantiates a unigram language model.",tensor([[1.0000]]),tensor([[1.]]),0.999999995
