,translated_answer,translated_question,question,answer,qa_pair_score,most_relevant_contexts,context_scores,true_answer,true_context,true_answer_similarity_score,true_context_similarity_score,true_answer_ROUGE_L
0,zero or more occurrences of the immediately previous character or regular expression,What is the meaning of the Kleene star in Regex?,What is the meaning of the Kleene star in Regex?,zero or more occurrences of the immediately previous character or regular expression,"[{'label': 'LABEL_1', 'score': 0.6614019274711609}]","['The wildcard is often used together with the Kleene star to mean ""any string of characters"". For example, suppose we want to find any line in which a particular word, for example, aardvark, appears twice. We can specify this with the regular expression /aardvark.*aardvark/.', '/the*/ matches theeeee but not thethe. Because sequences have a higher precedence than disjunction, /the|any/ matches the or any but not thany or theny. Patterns can be ambiguous in another way. Consider the expression /[a-z]*/ when matching against the text once upon a time. Since /[a-z]*/ matches zero or more letters, this expression could match nothing, or just the first letter o, on, onc, or once. In these cases regular expressions always match the largest string they can; we say that patterns are greedy, expanding to cover as much of a string as they can. There are, however, ways to enforce non-greedy matching, using another meaning of the ? qualifier. The operator *? is a Kleene star that matches as little text as possible. The operator +? is a Kleene plus that matches as little text as possible.', 'This language consists of strings with a b, followed by at least two a\'s, followed by an exclamation point. The set of operators that allows us to say things like ""some number of as"" are based on the asterisk or *, commonly called the Kleene * (gen-Kleene * erally pronounced ""cleany star""). The Kleene star means ""zero or more occurrences of the immediately previous character or regular expression"". So /a*/ means ""any string of zero or more as"". This will match a or aaaaaa, but it will also match Off Minor since the string Off Minor has zero a\'s. So the regular expression for matching one or more a is /aa*/, meaning one a followed by zero or more as. More complex patterns can also be repeated. So /[ab]*/ means ""zero or more a\'s or b\'s"" (not ""zero or more right square braces""). This will match strings like aaaa or ababab or bbbb.', 'The parenthesis operator ( is also useful when we are using counters like the Kleene*. Unlike the | operator, the Kleene* operator applies by default only to a single character, not to a whole sequence. Suppose we want to match repeated instances of a string. Perhaps we have a line that has column labels of the form Column 1 Column 2 Column 3. The expression /Column [0-9]+ */ will not match any number of columns; instead, it will match a single column followed by any number of spaces! The star here applies only to the space that precedes it, not to the whole sequence. With the parentheses, we could write the expression /(Column [0-9]+ *)*/ to match the word Column, followed by a number and optional spaces, the whole pattern repeated zero or more times.', 'The regular expression /[1234567890]/ specifies any single digit. While such classes of characters as digits or letters are important building blocks in expressions, they can get awkward (e.g., it’s inconvenient to specify /[ABCDEFGHIJKLMNOPQRSTUVWXYZ]/ to mean “any capital letter”). In cases where there is a well-defined sequence associated with a set of characters, the brackets can be used with the dash (-) to specify any one character in a range. The pattern /[2-5]/ specifies any one of the characters 2, 3, 4, or 5. The pattern /[b-g]/ specifies one of the characters b, c, d, e, f, or g. Some other examples are shown in Fig. 2.3.']","[0.7884208559989929, 0.864996612071991, 0.9096366167068481, 0.9145306944847107, 0.9443280696868896]","The Kleene star means ""zero or more occurrences of the immediately previous character or regular expression""","This language consists of strings with a b, followed by at least two a's, followed by an exclamation point. The set of operators that allows us to say things like ""some number of as"" are based on the asterisk or *, commonly called the Kleene * (gen-Kleene * erally pronounced ""cleany star""). The Kleene star means ""zero or more occurrences of the immediately previous character or regular expression"". So /a*/ means ""any string of zero or more as"". This will match a or aaaaaa, but it will also match Off Minor since the string Off Minor has zero a's. So the regular expression for matching one or more a is /aa*/, meaning one a followed by zero or more as. More complex patterns can also be repeated. So /[ab]*/ means ""zero or more a's or b's"" (not ""zero or more right square braces""). This will match strings like aaaa or ababab or bbbb.",tensor([[0.5945]]),tensor([[0.5623]]),0.6923076874260355
1,non-capture groups,"What is the usage of the Regex lookahead operator ""?=""?","What is the usage of the Regex lookahead operator ""?=""?",non-capture groups,"[{'label': 'LABEL_0', 'score': 0.8437103629112244}]","['These lookahead assertions make use of the (? syntax that we saw in the previous section for non-capture groups. The operator (?= pattern) is true if pattern occurs, but is zero-width, i.e. the match pointer doesn’t advance. The operator (?! pattern) only returns true if a pattern does not match, but again is zero-width and doesn’t advance the cursor. Negative lookahead is commonly used when we are parsing some complex pattern but want to rule out a special case. For example suppose we want to match, at the beginning of a line, any single word that doesn’t start with “Volcano”. We can use negative lookahead to do this: /ˆ(?!Volcano)[A-Za-z]+/', '/the*/ matches theeeee but not thethe. Because sequences have a higher precedence than disjunction, /the|any/ matches the or any but not thany or theny. Patterns can be ambiguous in another way. Consider the expression /[a-z]*/ when matching against the text once upon a time. Since /[a-z]*/ matches zero or more letters, this expression could match nothing, or just the first letter o, on, onc, or once. In these cases regular expressions always match the largest string they can; we say that patterns are greedy, expanding to cover as much of a string as they can. There are, however, ways to enforce non-greedy matching, using another meaning of the ? qualifier. The operator *? is a Kleene star that matches as little text as possible. The operator +? is a Kleene plus that matches as little text as possible.', ""Parentheses thus have a double function in regular expressions; they are used to group terms for specifying the order in which operators should apply, and they are used to capture something in a register. Occasionally we might want to use parentheses for grouping, but don't want to capture the resulting pattern in a register. In that case we use a non-capturing group, which is specified by putting the commands non-capturing group ?: after the open paren, in the form (?: pattern). /(?:some|a few) (people|cats) like some \\\\1/ will match some cats like some cats but not some cats like some a few."", 'One of the unsung successes in standardization in computer science has been the regular expression (RE), a language for specifying text search strings. This prac-regular expression tical language is used in every computer language, word processor, and text processing tools like the Unix tools grep or Emacs. Formally, a regular expression is an algebraic notation for characterizing a set of strings. They are particularly useful for searching in texts, when we have a pattern to search for and a corpus of texts to search through. A regular expression search function will search through the corpus, returning all texts that match the pattern. The corpus can be a single document or a collection. For example, the Unix command-line tool grep takes a regular expression and returns every line of the input document that matches the expression.', 'The parenthesis operator ( is also useful when we are using counters like the Kleene*. Unlike the | operator, the Kleene* operator applies by default only to a single character, not to a whole sequence. Suppose we want to match repeated instances of a string. Perhaps we have a line that has column labels of the form Column 1 Column 2 Column 3. The expression /Column [0-9]+ */ will not match any number of columns; instead, it will match a single column followed by any number of spaces! The star here applies only to the space that precedes it, not to the whole sequence. With the parentheses, we could write the expression /(Column [0-9]+ *)*/ to match the word Column, followed by a number and optional spaces, the whole pattern repeated zero or more times.']","[0.7294178009033203, 0.8667194843292236, 0.912268340587616, 0.930334746837616, 0.967867374420166]","The operator (?= pattern) is true if pattern occurs, but is zero-width, i.e. the match pointer doesn’t advance.","These lookahead assertions make use of the (? syntax that we saw in the previous section for non-capture groups. The operator (?= pattern) is true if pattern occurs, but is zero-width, i.e. the match pointer doesn’t advance. The operator (?! pattern) only returns true if a pattern does not match, but again is zero-width and doesn’t advance the cursor. Negative lookahead is commonly used when we are parsing some complex pattern but want to rule out a special case. For example suppose we want to match, at the beginning of a line, any single word that doesn’t start with “Volcano”. We can use negative lookahead to do this: /ˆ(?!Volcano)[A-Za-z]+/",tensor([[0.0643]]),tensor([[1.]]),0.0
2,tokenizing (segmenting) words,What are the most common steps in a text normalization process?,What are the most common steps in a text normalization process?,tokenizing (segmenting) words,"[{'label': 'LABEL_1', 'score': 0.9853554964065552}]","['Before almost any natural language processing of a text, the text has to be normalized. At least three tasks are commonly applied as part of any normalization process: 1. Tokenizing (segmenting) words 2. Normalizing word formats 3. Segmenting sentences In the next sections we walk through each of these tasks.', 'Another part of text normalization is lemmatization, the task of determining that two words have the same root, despite their surface differences. For example, the words sang, sung, and sings are forms of the verb sing. The word sing is the common lemma of these words, and a lemmatizer maps from all of these to sing. Lemmatization is essential for processing morphologically complex languages like Arabic. Stemming refers to a simpler version of lemmatization in which we mainly just strip suffixes from the end of the word. Text normalization also includes sentence segmentation: breaking up a text into individual sentences, using cues like periods or exclamation points.', '• Word tokenization and normalization are generally done by cascades of simple regular expression substitutions or finite automata.', 'Kleene 1951; 1956 first defined regular expressions and the finite automaton, based on the McCulloch-Pitts neuron. Ken Thompson was one of the first to build regular expressions compilers into editors for text searching (Thompson, 1968) . His editor ed included a command ""g/regular expression/p"", or Global Regular Expression Print, which later became the Unix grep utility. Text normalization algorithms have been applied since the beginning of the field. One of the earliest widely used stemmers was Lovins (1968) . Stemming was also applied early to the digital humanities, by Packard (1973) , who built an affix-stripping morphological parser for Ancient Greek. Currently a wide variety of code for tokenization and normalization is available, such as the Stanford Tokenizer (http://nlp.stanford.edu/software/tokenizer.shtml) or specialized tokenizers for Twitter (O\'Connor et al., 2010) , or for sentiment (http: //sentiment.christopherpotts.net/tokenizing.html). See Palmer (2012) for a survey of text preprocessing. NLTK is an essential tool that offers both useful Python libraries (http://www.nltk.org) and textbook descriptions (Bird et al., 2009 ) of many algorithms including text normalization and corpus interfaces.', ""This chapter introduced a fundamental tool in language processing, the regular expression, and showed how to perform basic text normalization tasks including word segmentation and normalization, sentence segmentation, and stemming. We also introduced the important minimum edit distance algorithm for comparing strings. Here's a summary of the main points we covered about these ideas:""]","[0.6793863773345947, 0.8233054876327515, 0.8524851202964783, 0.8605782389640808, 0.8674665093421936]",1. Tokenizing (segmenting) words 2. Normalizing word formats 3. Segmenting sentences,"Before almost any natural language processing of a text, the text has to be normalized. At least three tasks are commonly applied as part of any normalization process: 1. Tokenizing (segmenting) words 2. Normalizing word formats 3. Segmenting sentences In the next sections we walk through each of these tasks.",tensor([[0.8293]]),tensor([[1.0000]]),0.28571428234693885
3,token learner and token segmenter,What are the two most common components of a tokenization scheme?,What are the two most common components of a tokenization scheme?,token learner and token segmenter,"[{'label': 'LABEL_0', 'score': 0.9818190336227417}]","['Most tokenization schemes have two parts: a token learner, and a token segmenter. The token learner takes a raw training corpus (sometimes roughly preseparated into words, for example by whitespace) and induces a vocabulary, a set of tokens. The token segmenter takes a raw test sentence and segments it into the tokens in the vocabulary. Three algorithms are widely used: byte-pair encoding (Sennrich et al., 2016) , unigram language modeling (Kudo, 2018) , and WordPiece (Schuster and Nakajima, 2012) ; there is also a SentencePiece library that includes implementations of the first two of the three (Kudo and Richardson, 2018) .', 'One commonly used tokenization standard is known as the Penn Treebank tokenization standard, used for the parsed corpora (treebanks) released by the Linguistic Data Consortium (LDC), the source of many useful datasets. This standard separates out clitics (doesn’t becomes does plus n’t), keeps hyphenated words together, and separates out all punctuation (to save space we’re showing visible spaces ‘ ’ between tokens, although newlines is a more common output):', ""complementizer Pronouns act as a shorthand for referring to an entity or event. Personal propronoun nouns refer to persons or entities (you, she, I, it, me, etc.). Possessive pronouns are forms of personal pronouns that indicate either actual possession or more often just an abstract relation between the person and some object (my, your, his, her, its, one's, our, their). Wh-pronouns (what, who, whom, whoever) are used in certain wh question forms, or act as complementizers (Frida, who married Diego. . . ). Auxiliary verbs mark semantic features of a main verb such as its tense, whether auxiliary it is completed (aspect), whether it is negated (polarity), and whether an action is necessary, possible, suggested, or desired (mood). English auxiliaries include the copula verb be, the two verbs do and have, forms, as well as modal verbs used to copula modal mark the mood associated with the event depicted by the main verb: can indicates ability or possibility, may permission or possibility, must necessity. An English-specific tagset, the 45-tag Penn Treebank tagset (Marcus et al., 1993) , shown in Fig. 8.2 , has been used to label many syntactically annotated corpora like the Penn Treebank corpora, so is worth knowing about. Below we show some examples with each word tagged according to both the UD and Penn tagsets. Notice that the Penn tagset distinguishes tense and participles on verbs, and has a special tag for the existential there construction in English. Note that since New England Journal of Medicine is a proper noun, both tagsets mark its component nouns as NNP, including journal and medicine, which might otherwise be labeled as common nouns (NOUN/NN)."", '• Word tokenization and normalization are generally done by cascades of simple regular expression substitutions or finite automata.', 'While the Unix command sequence just removed all the numbers and punctuation, for most NLP applications we’ll need to keep these in our tokenization. We often want to break off punctuation as a separate token; commas are a useful piece of information for parsers, periods help indicate sentence boundaries. But we’ll often want to keep the punctuation that occurs word internally, in examples like m.p.h., Ph.D., AT&T, and cap’n. Special characters and numbers will need to be kept in prices ($45.55) and dates (01/02/06); we don’t want to segment that price into separate tokens of “45” and “55”. And there are URLs (http://www.stanford.edu), Twitter hashtags (#nlproc), or email addresses (someone@cs.colorado.edu).']","[0.8221443295478821, 0.9568235278129578, 0.9572544097900391, 0.9578598737716675, 0.9646700620651245]","a token learner, and a token segmenter","Most tokenization schemes have two parts: a token learner, and a token segmenter. The token learner takes a raw training corpus (sometimes roughly preseparated into words, for example by whitespace) and induces a vocabulary, a set of tokens. The token segmenter takes a raw test sentence and segments it into the tokens in the vocabulary. Three algorithms are widely used: byte-pair encoding (Sennrich et al., 2016) , unigram language modeling (Kudo, 2018) , and WordPiece (Schuster and Nakajima, 2012) ; there is also a SentencePiece library that includes implementations of the first two of the three (Kudo and Richardson, 2018) .",tensor([[0.9798]]),tensor([[1.0000]]),0.6666666617283951
4,to segment test sentences into tokens that are in the vocabulary.,What is the purpose of a token segmenter?,What is the purpose of a token segmenter?,to segment test sentences into tokens that are in the vocabulary.,"[{'label': 'LABEL_0', 'score': 0.9931784868240356}]","['Most tokenization schemes have two parts: a token learner, and a token segmenter. The token learner takes a raw training corpus (sometimes roughly preseparated into words, for example by whitespace) and induces a vocabulary, a set of tokens. The token segmenter takes a raw test sentence and segments it into the tokens in the vocabulary. Three algorithms are widely used: byte-pair encoding (Sennrich et al., 2016) , unigram language modeling (Kudo, 2018) , and WordPiece (Schuster and Nakajima, 2012) ; there is also a SentencePiece library that includes implementations of the first two of the three (Kudo and Richardson, 2018) .', ""Once we've learned our vocabulary, the token parser is used to tokenize a test sentence. The token parser just runs on the test data the merges we have learned from the training data, greedily, in the order we learned them. (Thus the frequencies in the test data don't play a role, just the frequencies in the training data). So first we segment each test sentence word into characters. Then we apply the first rule: replace every instance of e r in the test corpus with er, and then the second rule: replace every instance of er in the test corpus with er , and so on. By the end, if the test corpus contained the word n e w e r , it would be tokenized as a full word. But a new (unknown) word like l o w e r would be merged into the two tokens low er ."", 'There is a third option to tokenizing text. Instead of defining tokens as words (whether delimited by spaces or more complex algorithms), or as characters (as in Chinese), we can use our data to automatically tell us what the tokens should be. This is especially useful in dealing with unknown words, an important problem in language processing. As we will see in the next chapter, NLP algorithms often learn some facts about language from one corpus (a training corpus) and then use these facts to make decisions about a separate test corpus and its language. Thus if our training corpus contains, say the words low, new, newer, but not lower, then if the word lower appears in our test corpus, our system will not know what to do with it.', 'While the Unix command sequence just removed all the numbers and punctuation, for most NLP applications we’ll need to keep these in our tokenization. We often want to break off punctuation as a separate token; commas are a useful piece of information for parsers, periods help indicate sentence boundaries. But we’ll often want to keep the punctuation that occurs word internally, in examples like m.p.h., Ph.D., AT&T, and cap’n. Special characters and numbers will need to be kept in prices ($45.55) and dates (01/02/06); we don’t want to segment that price into separate tokens of “45” and “55”. And there are URLs (http://www.stanford.edu), Twitter hashtags (#nlproc), or email addresses (someone@cs.colorado.edu).', 'Span-oriented applications operate in a middle ground between sequence level and token level tasks. That is, in span-oriented applications the focus is on generating and operating with representations of contiguous sequences of tokens. Typical operations include identifying spans of interest, classifying spans according to some labeling scheme, and determining relations among discovered spans. Applications include named entity recognition, question answering, syntactic parsing, semantic role labeling and coreference resolution.']","[0.9475776553153992, 0.9580755829811096, 0.9916033744812012, 0.9925007224082947, 0.9991033673286438]",The token segmenter takes a raw test sentence and segments it into the tokens in the vocabulary.,"Most tokenization schemes have two parts: a token learner, and a token segmenter. The token learner takes a raw training corpus (sometimes roughly preseparated into words, for example by whitespace) and induces a vocabulary, a set of tokens. The token segmenter takes a raw test sentence and segments it into the tokens in the vocabulary. Three algorithms are widely used: byte-pair encoding (Sennrich et al., 2016) , unigram language modeling (Kudo, 2018) , and WordPiece (Schuster and Nakajima, 2012) ; there is also a SentencePiece library that includes implementations of the first two of the three (Kudo and Richardson, 2018) .",tensor([[0.8883]]),tensor([[1.0000]]),0.44444443961591223
5,to learn a vocabulary,What is the purpose of a token learner in the BPE algorithm?,What is the purpose of a token learner in the BPE algorithm?,to learn a vocabulary,"[{'label': 'LABEL_0', 'score': 0.9895667433738708}]","['The token learner part of the BPE algorithm for taking a corpus broken up into individual characters or bytes, and learning a vocabulary by iteratively merging tokens.', ""In this section we introduce the simplest of the three, the byte-pair encoding or BPE algorithm (Sennrich et al., 2016) ; see Fig. 2 .13. The BPE token learner begins BPE with a vocabulary that is just the set of all individual characters. It then examines the training corpus, chooses the two symbols that are most frequently adjacent (say 'A', 'B'), adds a new merged symbol 'AB' to the vocabulary, and replaces every adjacent 'A' 'B' in the corpus with the new 'AB'. It continues to count and merge, creating new longer and longer character strings, until k merges have been done creating k novel tokens; k is thus a parameter of the algorithm. The resulting vocabulary consists of the original set of characters plus k new symbols."", 'Most tokenization schemes have two parts: a token learner, and a token segmenter. The token learner takes a raw training corpus (sometimes roughly preseparated into words, for example by whitespace) and induces a vocabulary, a set of tokens. The token segmenter takes a raw test sentence and segments it into the tokens in the vocabulary. Three algorithms are widely used: byte-pair encoding (Sennrich et al., 2016) , unigram language modeling (Kudo, 2018) , and WordPiece (Schuster and Nakajima, 2012) ; there is also a SentencePiece library that includes implementations of the first two of the three (Kudo and Richardson, 2018) .', ""Fine-tuning an application for one of these tasks proceeds just as with pretraining using the NSP objective. During fine-tuning, pairs of labeled sentences from the supervised training data are presented to the model. As with sequence classification, the output vector associated with the prepended [CLS] token represents the model's view of the input pair. And as with NSP training, the two inputs are separated by the a [SEP] token. To perform classification, the [CLS] vector is multiplied by a set of learning classification weights and passed through a softmax to generate label predictions, which are then used to update the weights."", 'We gave the BPE algorithm in detail in Chapter 2; here are more details on the wordpiece algorithm, which is given a training corpus and a desired vocabulary size and proceeds as follows:']","[0.7043236494064331, 0.9302681088447571, 0.9681751728057861, 0.9851445555686951, 0.9875163435935974]","taking a corpus broken up into individual characters or bytes, and learning a vocabulary by iteratively merging tokens.","The token learner part of the BPE algorithm for taking a corpus broken up into individual characters or bytes, and learning a vocabulary by iteratively merging tokens.",tensor([[0.5061]]),tensor([[1.]]),0.19047618739229027
