,translated_answer,translated_question,question,answer,qa_pair_score,most_relevant_contexts,context_scores,true_answer,true_context,true_answer_similarity_score,true_context_similarity_score,true_answer_ROUGE_L
32,each cell represents the number of times the row (target) word and the column (context,What do rows represent in a term-document matrix?,What do rows represent in a term-document matrix?,each cell represents the number of times the row (target) word and the column (context,"[{'label': 'LABEL_0', 'score': 0.9931261539459229}]","['The term-document matrix of Fig. 6 .2 was first defined as part of the vector space model of information retrieval (Salton, 1971). In this model, a document is represented as a count vector, a column in Fig. 6.3.', ""A real term-document matrix, of course, wouldn't just have 4 rows and columns, let alone 2. More generally, the term-document matrix has |V | rows (one for each word type in the vocabulary) and D columns (one for each document in the collection); as we'll see, vocabulary sizes are generally in the tens of thousands, and the number of documents can be enormous (think about all the pages on the web)."", 'An alternative to using the term-document matrix to represent words as vectors of document counts, is to use the term-term matrix, also called the word-word matrix or the term-context matrix, in which the columns are labeled by words rather word-word matrix than documents. This matrix is thus of dimensionality |V |×|V | and each cell records the number of times the row (target) word and the column (context) word co-occur in some context in some training corpus. The context could be the document, in which case the cell represents the number of times the two words appear in the same document. It is most common, however, to use smaller contexts, generally a window around the word, for example of 4 words to the left and 4 words to the right, in which case the cell represents the number of times (in some training corpus) the column word occurs in such a ±4 word window around the row word. For example here is one example each of some words in their windows:', 'In a term-document matrix, each row represents a word in the vocabulary and each term-document matrix column represents a document from some collection of documents. Fig. 6 .2 shows a small selection from a term-document matrix showing the occurrence of four words in four plays by Shakespeare. Each cell in this matrix represents the number of times a particular word (defined by the row) occurs in a particular document (defined by the column). Thus fool appeared 58 times in Twelfth Night.', 'In the example in Fig. 6 .3, the document vectors are of dimension 4, dimension just so they fit on the page; in real term-document matrices, the vectors representing each document would have dimensionality |V |, the vocabulary size. The ordering of the numbers in a vector space indicates different meaningful dimensions on which documents vary. Thus the first dimension for both these vectors corresponds to the number of times the word battle occurs, and we can compare each dimension, noting for example that the vectors for As You Like It and Twelfth Night have similar values (1 and 0, respectively) for the first dimension. Figure 6 .3 The term-document matrix for four words in four Shakespeare plays. The red boxes show that each document is represented as a column vector of length four.']","[0.7378557324409485, 0.8148851990699768, 0.8512870669364929, 0.8527183532714844, 0.86329585313797]",a word in the vocabulary,"In a term-document matrix, each row represents a word in the vocabulary and each term-document matrix column represents a document from some collection of documents. Fig. 6 .2 shows a small selection from a term-document matrix showing the occurrence of four words in four plays by Shakespeare. Each cell in this matrix represents the number of times a particular word (defined by the row) occurs in a particular document (defined by the column). Thus fool appeared 58 times in Twelfth Night.",tensor([[0.2907]]),tensor([[0.5632]]),0.2222222182098766
33,each cell records the number of times the row (target) word and the column (context,What do columns represent in a term-document matrix?,What do columns represent in a term-document matrix?,each cell records the number of times the row (target) word and the column (context,"[{'label': 'LABEL_0', 'score': 0.9895081520080566}]","['The term-document matrix of Fig. 6 .2 was first defined as part of the vector space model of information retrieval (Salton, 1971). In this model, a document is represented as a count vector, a column in Fig. 6.3.', ""A real term-document matrix, of course, wouldn't just have 4 rows and columns, let alone 2. More generally, the term-document matrix has |V | rows (one for each word type in the vocabulary) and D columns (one for each document in the collection); as we'll see, vocabulary sizes are generally in the tens of thousands, and the number of documents can be enormous (think about all the pages on the web)."", 'An alternative to using the term-document matrix to represent words as vectors of document counts, is to use the term-term matrix, also called the word-word matrix or the term-context matrix, in which the columns are labeled by words rather word-word matrix than documents. This matrix is thus of dimensionality |V |×|V | and each cell records the number of times the row (target) word and the column (context) word co-occur in some context in some training corpus. The context could be the document, in which case the cell represents the number of times the two words appear in the same document. It is most common, however, to use smaller contexts, generally a window around the word, for example of 4 words to the left and 4 words to the right, in which case the cell represents the number of times (in some training corpus) the column word occurs in such a ±4 word window around the row word. For example here is one example each of some words in their windows:', 'In a term-document matrix, each row represents a word in the vocabulary and each term-document matrix column represents a document from some collection of documents. Fig. 6 .2 shows a small selection from a term-document matrix showing the occurrence of four words in four plays by Shakespeare. Each cell in this matrix represents the number of times a particular word (defined by the row) occurs in a particular document (defined by the column). Thus fool appeared 58 times in Twelfth Night.', '• Vector semantic models fall into two classes: sparse and dense. In sparse models each dimension corresponds to a word in the vocabulary V and cells are functions of co-occurrence counts. The term-document matrix has a row for each word (term) in the vocabulary and a column for each document. The word-context or term-term matrix has a row for each (target) word in the vocabulary and a column for each context term in the vocabulary. Two sparse weightings are common: the tf-idf weighting which weights each cell by its term frequency and inverse document frequency, and PPMI (pointwise positive mutual information) most common for for word-context matrices.']","[0.6958948969841003, 0.7863481640815735, 0.8080623149871826, 0.8336585164070129, 0.8620412945747375]",a document from some collection of documents,"In a term-document matrix, each row represents a word in the vocabulary and each term-document matrix column represents a document from some collection of documents. Fig. 6 .2 shows a small selection from a term-document matrix showing the occurrence of four words in four plays by Shakespeare. Each cell in this matrix represents the number of times a particular word (defined by the row) occurs in a particular document (defined by the column). Thus fool appeared 58 times in Twelfth Night.",tensor([[0.1537]]),tensor([[0.5632]]),0.09999999545000023
34,because it will tend to be high just when the two vectors have large values in the same,Why can dot product be used as a similarity metric?,Why can dot product be used as a similarity metric?,because it will tend to be high just when the two vectors have large values in the same,"[{'label': 'LABEL_0', 'score': 0.9758784174919128}]","['This raw dot product, however, has a problem as a similarity metric: it favors long vectors. The vector length is defined as', 'As we will see, most metrics for similarity between vectors are based on the dot product. The dot product acts as a similarity metric because it will tend to be high just when the two vectors have large values in the same dimensions. Alternatively, vectors that have zeros in different dimensions-orthogonal vectors-will have a dot product of 0, representing their strong dissimilarity.', ""The dot product is higher if a vector is longer, with higher values in each dimension. More frequent words have longer vectors, since they tend to co-occur with more words and have higher co-occurrence values with each of them. The raw dot product thus will be higher for frequent words. But this is a problem; we'd like a similarity metric that tells us how similar two words are regardless of their frequency."", 'The result of a dot product is a scalar value ranging from −∞ to ∞, the larger the value the more similar the vectors that are being compared. Continuing with our example, the first step in computing y 3 would be to compute three scores:', 'The cosine-like most measures for vector similarity used in NLP-is based on the dot product operator from linear algebra, also called the inner product:']","[0.6735051274299622, 0.6952444314956665, 0.8224063515663147, 0.8852991461753845, 0.9045937061309814]",The dot product acts as a similarity metric because it will tend to be high just when the two vectors have large values in the same dimensions.,"As we will see, most metrics for similarity between vectors are based on the dot product. The dot product acts as a similarity metric because it will tend to be high just when the two vectors have large values in the same dimensions. Alternatively, vectors that have zeros in different dimensions-orthogonal vectors-will have a dot product of 0, representing their strong dissimilarity.",tensor([[0.5201]]),tensor([[0.5989]]),0.7906976696376421
35,"P(w)P(c) , 0)",What is the intuition behind PPMI?,What is the intuition behind PPMI?,"P(w)P(c) , 0)","[{'label': 'LABEL_0', 'score': 0.9730887413024902}]","['PMI has the problem of being biased toward infrequent events; very rare words tend to have very high PMI values. One way to reduce this bias toward low frequency Figure 6 .12 The PPMI matrix showing the association between words and context words, computed from the counts in Fig. 6 .11. Note that most of the 0 PPMI values are ones that had a negative PMI; for example PMI(cherry,computer) = -6.7, meaning that cherry and computer co-occur on Wikipedia less often than we would expect by chance, and with PPMI we replace negative values by zero. events is to slightly change the computation for P(c), using a different function P α (c) that raises the probability of the context word to the power of α:', 'The model computes the similarity between two words x and y by taking the cosine of their tf-idf or PPMI vectors; high cosine, high similarity. This entire model is sometimes referred to as the tf-idf model or the PPMI model, after the weighting function.', 'PPMI(w, c) = max(log 2 P(w, c) P(w)P(c) , 0) (6.18)', 'PPMI α (w, c) = max(log 2 P(w, c) P(w)P α (c) , 0) (6.21) P α (c) = count(c) α c count(c) α (6.22)', 'An alternative weighting function to tf-idf, PPMI (positive pointwise mutual information), is used for term-term-matrices, when the vector dimensions correspond to words rather than documents. PPMI draws on the intuition that the best way to weigh the association between two words is to ask how much more the two words co-occur in our corpus than we would have a priori expected them to appear by chance.']","[0.8627848029136658, 0.8946728110313416, 0.9539735317230225, 0.9563643336296082, 0.9674333930015564]",PPMI draws on the intuition that the best way to weigh the association between two words is to ask how much more the two words co-occur in our corpus than we would have a priori expected them to appear by chance.,"An alternative weighting function to tf-idf, PPMI (positive pointwise mutual information), is used for term-term-matrices, when the vector dimensions correspond to words rather than documents. PPMI draws on the intuition that the best way to weigh the association between two words is to ask how much more the two words co-occur in our corpus than we would have a priori expected them to appear by chance.",tensor([[0.1125]]),tensor([[0.5289]]),0.0
36,k,What is a centroid?,What is a centroid?,k,"[{'label': 'LABEL_0', 'score': 0.9689978957176208}]","['The centroid is the multidimensional version of the mean; the centroid of a set of vectors is a single vector that has the minimum sum of squared distances to each of the vectors in the set. Given k word vectors w 1 , w 2 , ..., w k , the centroid document vector d is:', 'The asphalt that Los Angeles is famous for occurs mainly on its freeways. But in the middle of the city is another patch of asphalt, the La Brea tar pits, and this asphalt preserves millions of fossil bones from the last of the Ice Ages of the Pleistocene Epoch. One of these fossils is the Smilodon, or saber-toothed tiger, instantly recognizable by its long canines. Five million years ago or so, a completely different sabre-tooth tiger called Thylacosmilus lived in Argentina and other parts of South America. Thylacosmilus was a marsupial whereas Smilodon was a placental mammal, but Thylacosmilus had the same long upper canines and, like Smilodon, had a protective bone flange on the lower jaw. The similarity of these two mammals is one of many examples of parallel or convergent evolution, in which particular contexts or environments lead to the evolution of very similar structures in different species (Gould, 1980) . The role of context is also important in the similarity of a less biological kind of organism: the word. Words that occur in similar contexts tend to have similar meanings. This link between similarity in how words are distributed and similarity in what they mean is called the distributional hypothesis. The hypothesis was distributional hypothesis first formulated in the 1950s by linguists like Joos (1950), Harris (1954) , and Firth (1957), who noticed that words which are synonyms (like oculist and eye-doctor) tended to occur in the same environment (e.g., near words like eye or examined) with the amount of meaning difference between two words ""corresponding roughly to the amount of difference in their environments"" (Harris, 1954, 157) . In this chapter we introduce vector semantics, which instantiates this linguistic vector semantics hypothesis by learning representations of the meaning of words, called embeddings, embeddings directly from their distributions in texts. These representations are used in every natural language processing application that makes use of meaning, and the static embeddings we introduce here underlie the more powerful dynamic or contextualized embeddings like BERT that we will see in Chapter 11.', ""complementizer Pronouns act as a shorthand for referring to an entity or event. Personal propronoun nouns refer to persons or entities (you, she, I, it, me, etc.). Possessive pronouns are forms of personal pronouns that indicate either actual possession or more often just an abstract relation between the person and some object (my, your, his, her, its, one's, our, their). Wh-pronouns (what, who, whom, whoever) are used in certain wh question forms, or act as complementizers (Frida, who married Diego. . . ). Auxiliary verbs mark semantic features of a main verb such as its tense, whether auxiliary it is completed (aspect), whether it is negated (polarity), and whether an action is necessary, possible, suggested, or desired (mood). English auxiliaries include the copula verb be, the two verbs do and have, forms, as well as modal verbs used to copula modal mark the mood associated with the event depicted by the main verb: can indicates ability or possibility, may permission or possibility, must necessity. An English-specific tagset, the 45-tag Penn Treebank tagset (Marcus et al., 1993) , shown in Fig. 8.2 , has been used to label many syntactically annotated corpora like the Penn Treebank corpora, so is worth knowing about. Below we show some examples with each word tagged according to both the UD and Penn tagsets. Notice that the Penn tagset distinguishes tense and participles on verbs, and has a special tag for the existential there construction in English. Note that since New England Journal of Medicine is a proper noun, both tagsets mark its component nouns as NNP, including journal and medicine, which might otherwise be labeled as common nouns (NOUN/NN)."", ""To the bottom right of the table is the equation for accuracy, which asks what percentage of all the observations (for the spam or pie examples that means all emails or tweets) our system labeled correctly. Although accuracy might seem a natural metric, we generally don't use it for text classification tasks. That's because accuracy doesn't work well when the classes are unbalanced (as indeed they are with spam, which is a large majority of email, or with tweets, which are mainly not about pie). To make this more explicit, imagine that we looked at a million tweets, and let's say that only 100 of them are discussing their love (or hatred) for our pie,"", ""We can think of the vector for a document as a point in |V |-dimensional space; thus the documents in Fig. 6 .3 are points in 4-dimensional space. Since 4-dimensional spaces are hard to visualize, Fig. 6 .4 shows a visualization in two dimensions; we've arbitrarily chosen the dimensions corresponding to the words battle and fool. Term-document matrices were originally defined as a means of finding similar documents for the task of document information retrieval. Two documents that are similar will tend to have similar words, and if two documents have similar words their column vectors will tend to be similar. The vectors for the comedies As You Like It [1, 114, 36, 20] and Twelfth Night [0,80,58,15] look a lot more like each other (more fools and wit than battles) than they look like Julius Caesar [7, 62, 1, 2] or Henry V [13, 89, 4, 3] . This is clear with the raw numbers; in the first dimension (battle) the comedies have low numbers and the others have high numbers, and we can see it visually in Fig. 6 .4; we'll see very shortly how to quantify this intuition more formally.""]","[0.7987896203994751, 1.092455267906189, 1.116712212562561, 1.1240885257720947, 1.1390451192855835]",a multidimensional version of the mean,"The centroid is the multidimensional version of the mean; the centroid of a set of vectors is a single vector that has the minimum sum of squared distances to each of the vectors in the set. Given k word vectors w 1 , w 2 , ..., w k , the centroid document vector d is:",tensor([[0.0358]]),tensor([[1.]]),0.0
