,translated_answer,translated_question,question,answer,qa_pair_score,most_relevant_contexts,context_scores,true_answer,true_context,true_answer_similarity_score,true_context_similarity_score,true_answer_ROUGE_L
45,a sentence is the context of the source text.,What is an autoregressive language model?,What is an autoregressive language model?,a sentence is the context of the source text.,"[{'label': 'LABEL_0', 'score': 0.8643854260444641}]","[""Technically an autoregressive model is a model that predicts a value at time t based on a linear function of the previous values at times t − 1, t − 2, and so on. Although language models are not linear (since they have many layers of non-linearities), we loosely refer to this generation technique as autoregressive generation since the word generated at each time step is conditioned on the word selected by the network from the previous step. Fig. 9 .9 illustrates this approach. In this figure, the details of the RNN's hidden layers and recurrent connections are hidden within the blue block. This simple architecture underlies state-of-the-art approaches to applications such as machine translation, summarization, and question answering. The key to these approaches is to prime the generation component with an appropriate context. That is, instead of simply using <s> to get things started we can provide a richer task-appropriate context; for translation the context is the sentence in the source language; for summarization it's the long text we want to summarize. We'll discuss the application of contextual generation to the problem of summarization in Section 9.9 in the context of transformer-based language models, and then again in Chapter 10 when we introduce encoder-decoder models."", 'A simple variation on autoregressive generation that underlies a number of practical applications uses a prior context to prime the autoregressive generation process. Fig. 9 .22 illustrates this with the task of text completion. Here a standard language model is given the prefix to some text and is asked to generate a possible completion to it. Note that as the generation process proceeds, the model has direct access to the priming context as well as to all of its own subsequently generated outputs. This ability to incorporate the entirety of the earlier context and generated outputs at each time step is the key to the power of these models. Text summarization is a practical application of context-based autoregressive Text summarization generation. The task is to take a full-length article and produce an effective summary of it. To train a transformer-based autoregressive model to perform this task, we start with a corpus consisting of full-length articles accompanied by their corresponding summaries. Fig. 9 .23 shows an example of this kind of data from a widely used summarization corpus consisting of CNN and Daily Mirror news articles.', 'We only have to make one slight change to turn this language model with autoregressive generation into a translation model that can translate from a source text source in one language to a target text in a second: add an sentence separation marker at target the end of the source text, and then simply concatenate the target text. We briefly introduced this idea of a sentence separator token in Chapter 9 when we considered using a Transformer language model to do summarization, by training a conditional language model. If we call the source text x and the target text y, we are computing the probability p(y|x) as follows: Fig. 10.4 shows the setup for a simplified version of the encoder-decoder model (we\'ll see the full model, which requires attention, in the next section). Fig. 10.4 shows an English source text (""the green witch arrived""), a sentence separator token (<s>, and a Spanish target text (""llegó la bruja verde""). To translate a source text, we run it through the network performing forward inference to generate hidden states until we get to the end of the source. Then we begin autoregressive generation, asking for a word in the context of the hidden layer from the end of the source input as well as the end-of-sentence marker. Subsequent words are conditioned on the previous hidden state and the embedding for the last word generated. Let\'s formalize and generalize this model a bit in Fig. 10 .5. (To help keep things straight, we\'ll use the superscripts e and d where needed to distinguish the hidden states of the encoder and the decoder.) The elements of the network on the left process the input sequence x and comprise the encoder. While our simplified figure shows only a single network layer for the encoder, stacked architectures are the norm, where the output states from the top layer of the stack are taken as the final representation. A widely used encoder design makes use of stacked biLSTMs where the hidden states from top layers from the forward and backward passes are concatenated as described in Chapter 9 to provide the contextualized representations for each time step. The entire purpose of the encoder is to generate a contextualized representation of the input. This representation is embodied in the final hidden state of the encoder, h e n . This representation, also called c for context, is then passed to the decoder. The decoder network on the right takes this state and uses it to initialize the first', ""Let's begin by introducing the bidirectional transformer encoder that underlies models like BERT and its descendants like RoBERTa (Liu et al., 2019) or SpanBERT (Joshi et al., 2020) . In Chapter 9 we explored causal (left-to-right) transformers that can serve as the basis for powerful language models-models that can easily be applied to autoregressive generation problems such as contextual generation, summarization and machine translation. However, when applied to sequence classification and labeling problems causal models have obvious shortcomings since they are based on an incremental, left-to-right processing of their inputs. If we want to assign the correct named-entity tag to each word in a sentence, or other sophisticated linguistic labels like the parse tags we'll introduce in later chapters, we'll want to be able to take into account information from the right context as we process each element. Fig. 11 .1, reproduced here from Chapter 9, illustrates the information flow in the purely left-to-right approach of Chapter 9. As can be seen, the hidden state computation at each point in time is based solely on the current and earlier elements of the input, ignoring potentially useful information located to the right of each tagging decision."", ""Modern language modeling is more commonly done with neural network language models, which solve the major problems with n-grams: the number of parameters increases exponentially as the n-gram order increases, and n-grams have no way to generalize from training to test set. Neural language models instead project words into a continuous space in which words with similar contexts have similar representations. We'll introduce both feedforward language models (Bengio et al. 2006 , Schwenk 2007 in Chapter 7, and recurrent language models (Mikolov, 2012) in Chapter 9.""]","[0.7993777990341187, 0.8181591033935547, 0.8543955683708191, 0.8793540000915527, 0.9067338109016418]","a model that predicts a value at time t based on a linear function of the previous values at times t − 1, t − 2, and so on.","Technically an autoregressive model is a model that predicts a value at time t based on a linear function of the previous values at times t − 1, t − 2, and so on. Although language models are not linear (since they have many layers of non-linearities), we loosely refer to this generation technique as autoregressive generation since the word generated at each time step is conditioned on the word selected by the network from the previous step. Fig. 9 .9 illustrates this approach. In this figure, the details of the RNN's hidden layers and recurrent connections are hidden within the blue block. This simple architecture underlies state-of-the-art approaches to applications such as machine translation, summarization, and question answering. The key to these approaches is to prime the generation component with an appropriate context. That is, instead of simply using <s> to get things started we can provide a richer task-appropriate context; for translation the context is the sentence in the source language; for summarization it's the long text we want to summarize. We'll discuss the application of contextual generation to the problem of summarization in Section 9.9 in the context of transformer-based language models, and then again in Chapter 10 when we introduce encoder-decoder models.",tensor([[0.0180]]),tensor([[1.]]),0.19999999608888894
46,removing information from the context and adding information likely to be needed for later decision making,What are the two subproblems derived from the context management problem by LSTMs?,What are the two subproblems derived from the context management problem by LSTMs?,removing information from the context and adding information likely to be needed for later decision making,"[{'label': 'LABEL_0', 'score': 0.9475328922271729}]","['The most commonly used such extension to RNNs is the Long short-term memory (LSTM) network (Hochreiter and Schmidhuber, 1997) . LSTMs divide the context management problem into two sub-problems: removing information no longer needed from the context, and adding information likely to be needed for later decision making. The key to solving both problems is to learn how to manage this context rather than hard-coding a strategy into the architecture. LSTMs accomplish this by first adding an explicit context layer to the architecture (in addition to the usual recurrent hidden layer), and through the use of specialized neural units that make use of gates to control the flow of information into and out of the units that comprise the network layers. These gates are implemented through the use of additional weights that operate sequentially on the input, and previous hidden layer, and previous context layers. The gates in an LSTM share a common design pattern; each consists of a feedforward layer, followed by a sigmoid activation function, followed by a pointwise multiplication with the layer being gated. The choice of the sigmoid as the activation function arises from its tendency to push its outputs to either 0 or 1. Combining this with a pointwise multiplication has an effect similar to that of a binary mask. Values in the layer being gated that align with values near 1 in the mask are passed through nearly unchanged; values corresponding to lower values are essentially erased.', 'While theoretically interesting, the difficulty with training RNNs and managing context over long sequences impeded progress on practical applications. This situation changed with the introduction of LSTMs in Hochreiter and Schmidhuber (1997) and Gers et al. (2000) . Impressive performance gains were demonstrated on tasks at the boundary of signal processing and language processing including phoneme recognition (Graves and Schmidhuber, 2005) , handwriting recognition (Graves et al., 2007) and most significantly speech recognition (Graves et al., 2013b) .', ""While the addition of gates allows LSTMs to handle more distant information than RNNs, they don't completely solve the underlying problem: passing information through an extended series of recurrent connections leads to information loss and difficulties in training. Moreover, the inherently sequential nature of recurrent networks makes it hard to do computation in parallel. These considerations led to the development of transformers -an approach to sequence processing that eliminates transformers recurrent connections and returns to architectures reminiscent of the fully connected networks described earlier in Chapter 7. Transformers map sequences of input vectors (x 1 , ..., x n ) to sequences of output vectors (y 1 , ..., y n ) of the same length. Transformers are made up of stacks of transformer blocks, which are multilayer networks made by combining simple linear layers, feedforward networks, and self-attention layers, they key innovation of self-attention transformers. Self-attention allows a network to directly extract and use information from arbitrarily large contexts without the need to pass it through intermediate recurrent connections as in RNNs. We'll start by describing how self-attention works and then return to how it fits into larger transformer blocks. Fig. 9 .15 illustrates the flow of information in a single causal, or backward looking, self-attention layer. As with the overall transformer, a self-attention layer maps input sequences (x 1 , ..., x n ) to output sequences of the same length (y 1 , ..., y n ). When processing each item in the input, the model has access to all of the inputs up to and including the one under consideration, but no access to information about inputs beyond the current one. In addition, the computation performed for each item is independent of all the other computations. The first point ensures that we can use this approach to create language models and use them for autoregressive generation, and the second point means that we can easily parallelize both forward inference and training of such models."", 'The increased complexity of the LSTM units is encapsulated within the unit itself. The only additional external complexity for the LSTM over the basic recurrent unit (b) is the presence of the additional context vector as an input and output.', ""Let's begin by introducing the bidirectional transformer encoder that underlies models like BERT and its descendants like RoBERTa (Liu et al., 2019) or SpanBERT (Joshi et al., 2020) . In Chapter 9 we explored causal (left-to-right) transformers that can serve as the basis for powerful language models-models that can easily be applied to autoregressive generation problems such as contextual generation, summarization and machine translation. However, when applied to sequence classification and labeling problems causal models have obvious shortcomings since they are based on an incremental, left-to-right processing of their inputs. If we want to assign the correct named-entity tag to each word in a sentence, or other sophisticated linguistic labels like the parse tags we'll introduce in later chapters, we'll want to be able to take into account information from the right context as we process each element. Fig. 11 .1, reproduced here from Chapter 9, illustrates the information flow in the purely left-to-right approach of Chapter 9. As can be seen, the hidden state computation at each point in time is based solely on the current and earlier elements of the input, ignoring potentially useful information located to the right of each tagging decision.""]","[0.8433900475502014, 0.9102267622947693, 0.9168379306793213, 0.9348389506340027, 0.9446735382080078]","removing information no longer needed from the context, and adding information likely to be needed for later decision making.","The most commonly used such extension to RNNs is the Long short-term memory (LSTM) network (Hochreiter and Schmidhuber, 1997) . LSTMs divide the context management problem into two sub-problems: removing information no longer needed from the context, and adding information likely to be needed for later decision making. The key to solving both problems is to learn how to manage this context rather than hard-coding a strategy into the architecture. LSTMs accomplish this by first adding an explicit context layer to the architecture (in addition to the usual recurrent hidden layer), and through the use of specialized neural units that make use of gates to control the flow of information into and out of the units that comprise the network layers. These gates are implemented through the use of additional weights that operate sequentially on the input, and previous hidden layer, and previous context layers. The gates in an LSTM share a common design pattern; each consists of a feedforward layer, followed by a sigmoid activation function, followed by a pointwise multiplication with the layer being gated. The choice of the sigmoid as the activation function arises from its tendency to push its outputs to either 0 or 1. Combining this with a pointwise multiplication has an effect similar to that of a binary mask. Values in the layer being gated that align with values near 1 in the mask are passed through nearly unchanged; values corresponding to lower values are essentially erased.",tensor([[0.9173]]),tensor([[1.]]),0.8749999950195313
47,to delete information from the context that is no longer needed.,What is the purpose of a forget gate in the LSTM architecture?,What is the purpose of a forget gate in the LSTM architecture?,to delete information from the context that is no longer needed.,"[{'label': 'LABEL_0', 'score': 0.879249095916748}]","['The most commonly used such extension to RNNs is the Long short-term memory (LSTM) network (Hochreiter and Schmidhuber, 1997) . LSTMs divide the context management problem into two sub-problems: removing information no longer needed from the context, and adding information likely to be needed for later decision making. The key to solving both problems is to learn how to manage this context rather than hard-coding a strategy into the architecture. LSTMs accomplish this by first adding an explicit context layer to the architecture (in addition to the usual recurrent hidden layer), and through the use of specialized neural units that make use of gates to control the flow of information into and out of the units that comprise the network layers. These gates are implemented through the use of additional weights that operate sequentially on the input, and previous hidden layer, and previous context layers. The gates in an LSTM share a common design pattern; each consists of a feedforward layer, followed by a sigmoid activation function, followed by a pointwise multiplication with the layer being gated. The choice of the sigmoid as the activation function arises from its tendency to push its outputs to either 0 or 1. Combining this with a pointwise multiplication has an effect similar to that of a binary mask. Values in the layer being gated that align with values near 1 in the mask are passed through nearly unchanged; values corresponding to lower values are essentially erased.', '(9.26) Fig. 9 .13 illustrates the complete computation for a single LSTM unit. Given the appropriate weights for the various gates, an LSTM accepts as input the context layer, and hidden layer from the previous time step, along with the current input vector. It then generates updated context and hidden vectors as output. The hidden layer, h t , can be used as input to subsequent layers in a stacked RNN, or to generate an output for the final layer of a network.', ""While the addition of gates allows LSTMs to handle more distant information than RNNs, they don't completely solve the underlying problem: passing information through an extended series of recurrent connections leads to information loss and difficulties in training. Moreover, the inherently sequential nature of recurrent networks makes it hard to do computation in parallel. These considerations led to the development of transformers -an approach to sequence processing that eliminates transformers recurrent connections and returns to architectures reminiscent of the fully connected networks described earlier in Chapter 7. Transformers map sequences of input vectors (x 1 , ..., x n ) to sequences of output vectors (y 1 , ..., y n ) of the same length. Transformers are made up of stacks of transformer blocks, which are multilayer networks made by combining simple linear layers, feedforward networks, and self-attention layers, they key innovation of self-attention transformers. Self-attention allows a network to directly extract and use information from arbitrarily large contexts without the need to pass it through intermediate recurrent connections as in RNNs. We'll start by describing how self-attention works and then return to how it fits into larger transformer blocks. Fig. 9 .15 illustrates the flow of information in a single causal, or backward looking, self-attention layer. As with the overall transformer, a self-attention layer maps input sequences (x 1 , ..., x n ) to output sequences of the same length (y 1 , ..., y n ). When processing each item in the input, the model has access to all of the inputs up to and including the one under consideration, but no access to information about inputs beyond the current one. In addition, the computation performed for each item is independent of all the other computations. The first point ensures that we can use this approach to create language models and use them for autoregressive generation, and the second point means that we can easily parallelize both forward inference and training of such models."", ""The first gate we'll consider is the forget gate. The purpose of this gate to delete information from the context that is no longer needed. The forget gate computes a weighted sum of the previous state's hidden layer and the current input and passes that through a sigmoid. This mask is then multiplied element-wise by the context vector to remove the information from context that is no longer required. Elementwise multiplication of two vectors (represented by the operator , and sometimes called the Hadamard product) is the vector of the same dimension as the two input vectors, where each element i is the product of element i in the two input vectors:"", '• In simple Recurrent Neural Networks sequences are processed one element at a time, with the output of each neural unit at time t based both on the current input at t and the hidden layer from time t − 1. • RNNs can be trained with a straightforward extension of the backpropagation algorithm, known as backpropagation through time (BPTT). • Simple recurrent networks fail on long inputs because of problems like vanishing gradients; instead modern systems use more complex gated architectures such as LSTMs that explicitly decide what to remember and forget in their hidden and context layers. • Transformers are non-recurrent networks based on self-attention. A selfattention layer maps input sequences to output sequences of the same length, based on a set of attention heads that each model how the surrounding words are relevant for the processing of the current word. • A transformer block consists of a single attention layer followed by a feedforward layer with residual connections and layer normalizations following each. Transformer blocks can be stacked to make deeper and more powerful networks. • Common language-based applications for RNNs and transformers include:']","[0.7927168011665344, 0.8767727613449097, 0.8894460201263428, 0.9238854050636292, 0.9356310963630676]",delete information from the context that is no longer needed,"The first gate we'll consider is the forget gate. The purpose of this gate to delete information from the context that is no longer needed. The forget gate computes a weighted sum of the previous state's hidden layer and the current input and passes that through a sigmoid. This mask is then multiplied element-wise by the context vector to remove the information from context that is no longer required. Elementwise multiplication of two vectors (represented by the operator , and sometimes called the Hadamard product) is the vector of the same dimension as the two input vectors, where each element i is the product of element i in the two input vectors:",tensor([[0.8317]]),tensor([[0.4225]]),0.9523809473922903
